{
  "$schema": "https://json-schema.org/draft/2020-12/schema",
  "$id": "https://ws.meriler.cc/content/schema/bank.schema.json",
  "title": "Банк картинок занятия — фаза 0 (нормативная схема, финализирована 2026-07-17)",
  "description": "Роли картинок не пересекаются (проверяет валидатор). Банко-зависимые экраны кодятся только при pilot_status=frozen (ТЗ §6, §7 п.5).",
  "type": "object",
  "required": ["id", "classes", "spurious", "pilot_status", "images"],
  "additionalProperties": false,
  "properties": {
    "id": { "type": "string", "pattern": "^[a-z0-9][a-z0-9-]*$" },
    "classes": {
      "type": "array",
      "minItems": 2,
      "maxItems": 2,
      "items": {
        "type": "object",
        "required": ["id", "label"],
        "additionalProperties": false,
        "properties": {
          "id": { "type": "string", "pattern": "^[a-z0-9][a-z0-9_-]*$" },
          "label": { "type": "string", "maxLength": 30 },
          "label_one": { "type": "string", "maxLength": 30, "description": "ед. число для подписей ошибок замера («кот», «собака»); нет — берётся label" }
        }
      },
      "description": "Фаза 0: ровно 2 класса (нода ImageClassifier среза — бинарная)"
    },
    "spurious": {
      "type": "string",
      "description": "Тайная примета (подвох). При провале пилота правится ЭТА строка + картинки — не код"
    },
    "pilot_status": { "enum": ["pending", "frozen"] },
    "frozen_params": {
      "type": "object",
      "required": ["frozen_at", "embedder", "k", "weights", "confidence_map"],
      "additionalProperties": false,
      "properties": {
        "frozen_at": { "type": "string", "format": "date" },
        "embedder": { "type": "string", "description": "точная модель, напр. mobilenet_v3_small_embedder.tflite" },
        "k": {
          "oneOf": [
            { "type": "integer", "minimum": 1 },
            {
              "type": "object",
              "required": ["small", "large", "min_class_size_for_large"],
              "additionalProperties": false,
              "properties": {
                "small": { "type": "integer", "minimum": 1 },
                "large": { "type": "integer", "minimum": 1 },
                "min_class_size_for_large": { "type": "integer", "minimum": 2 }
              },
              "description": "Двухступенчатое правило v5: k=small пока min(примеров на класс) < min_class_size_for_large, иначе k=large"
            }
          ]
        },
        "weights": {
          "type": "object",
          "required": ["embed", "pixel"],
          "additionalProperties": false,
          "properties": {
            "embed": { "type": "number", "minimum": 0, "maximum": 1 },
            "pixel": { "type": "number", "minimum": 0, "maximum": 1 }
          }
        },
        "confidence_map": {
          "type": "string",
          "description": "Формула/параметры маппинга расстояние→процент уверенности (фиксируется пилотом ДО заморозки, §6 п.3). С фазы 0.5 сигмоида — legacy-порог сырой маржи; экранный процент задаёт confidence_scale"
        },
        "confidence_scale": {
          "type": "object",
          "required": ["anchors"],
          "additionalProperties": false,
          "properties": {
            "calibrated_at": { "type": "string", "format": "date" },
            "anchors": {
              "type": "array",
              "minItems": 3,
              "maxItems": 4,
              "items": {
                "type": "array",
                "prefixItems": [
                  { "type": "number", "minimum": 0 },
                  { "type": "number", "minimum": 0, "maximum": 100 }
                ],
                "minItems": 2,
                "maxItems": 2
              },
              "description": "Опорные точки [margin, conf%] кусочно-линейной монотонной шкалы (3–4 точки, план-правок фаза 0.5); последняя точка — потолок (95). Монотонность и спектр проверяет pilot/calibrate_scale.mjs"
            },
            "note": { "type": "string" }
          },
          "description": "Калиброванная шкала экранного процента уверенности (фаза 0.5): выведена из маржей пилота, отчёт pilot/calibration-report.md"
        }
      }
    },
    "images": {
      "type": "array",
      "minItems": 1,
      "items": {
        "type": "object",
        "required": ["id", "class", "role", "src"],
        "additionalProperties": false,
        "properties": {
          "id": { "type": "string", "pattern": "^[a-z0-9][a-z0-9_-]*$" },
          "class": { "type": "string" },
          "role": {
            "enum": ["train_core", "probe", "trap", "holdout", "forecast", "buffer", "reserve"],
            "description": "Реестр ролей ЗАКРЫТ. Непересечение ролей и минимумы (holdout ≥4) проверяет валидатор"
          },
          "bg": { "type": "string", "description": "значение измерения подвоха (напр. дом/улица)" },
          "src": { "type": "string", "description": "путь в assets/ — существование проверяет валидатор" },
          "expected_flip": { "type": "boolean", "description": "для probe: ждём ошибку коробки (пилотный порог)" },
          "caption": { "type": "string", "maxLength": 80, "description": "честная подпись подачи (ловушки: «Кот на улице» — план-правок п.5)" }
        }
      }
    }
  },
  "if": { "properties": { "pilot_status": { "const": "frozen" } } },
  "then": { "required": ["frozen_params"] }
}
